name,company,company_review,est_salary,location,description
Business Analyst/ Quality Analyst/ Data Analyst- Entry level,Anjaneyap Global Inc,3.8 ★,$58k-$77k(Glassdoor est.),"– Kent, OH","Job Description
Role of a Quality Analyst: 1.Identify process requirements, monitor process implementation, evaluate process related issues, and identify needed corrective and preventive actions. 2.Prepare necessary reports, interface and coordinate with all levels; of staff including senior management. 3.Provide organizational support as directed by the Quality Assurance Manager. 4.Enforce document control procedures for maintaining control within the Quality Management System. 5. Identifies differences between establishment standards and user applications and suggests modifications to conform to standards. 6. Sets up tests at request of user to locate and correct program operating error following installation of program. 7.Conducts compatibility tests with vendor-provided programs. 8.Writes documentation to describe program evaluation, testing, and correction. 9.May evaluate proposed software or software enhancement for feasibility. 10.May develop utility program to test, track, and verify defects in software program. 11.May write programs to create new procedures or modify existing procedures. 12.May train software program users. 13.Perform additional duties as assigned

BA roles and responsibilities:

Worked as a bridge between business and technical stakeholders

In the requirement planning phase:

Responsible for:Preparing requirements charter to define the work and deliverables of the requirements team, define business needs, in scope and out of scope of the product development effort, requirement development activities , deliverables and milestones, requirements risks. It is used as a communication tool between business analyst and project manager.Identification and evaluation of primary and secondary stakeholders. That includes identification of stakeholders and their role in the organization, how they will be using the product, what requirement they can provide and who are the approvers of the requirements.

Elicitation phase

Preparation of Elicitation plan by mapping best suitable elicitation techniques for each stakeholder. For e.g interviews for the executives and Managers, workshops for the stakeholders with common interest, observations for the end users. Preparation of meetings logistics, interview questions and workshop agenda.Documentation of the information gathered in the elicitation sessions and prepare swim lane diagrams to model the flow of process through different stakeholders.

Analysis

Solution decomposition into business goals, functions and features. Analysis of stakeholder, functional, and non-functional requirements. Identification of assumptions and constraints.Preparation of use case models to identify the actors and processes. Documentation of use case description to identify the pre-conditions of each process, steps of the process and post conditions.Preparation of the flow diagrams to identify the process flow in different conditions and drive functional requirements for every possible condition.Preparation of dataflow diagram to identify data source and sink into or out of the process, data flow from process to another process and data storage.

DATA ANALYST ROLE: Responsible for doing data profiling, experting using tools like SSIS, SSRS and tools like informatica. Should be able to do ETL processes. Should be able to write with a business and create STM document. Should be able to write complex SQL queries to analyze the data. Should be able to capture the BI requirements.

Desired Skills and Experience

What You Need for This Position (minimum qualifications)

Graduates with good communication, technical skills and having specialized in: 1)BS/MS – Information Systems 2)Systems Eng 3)Technology Management 4)Electrical Eng 5)Industrial Eng/mechanical eng 6)BS/MS- Telecommunication 7)Computer Sc. 8)Software Eng 9)Computer Eng 10)MBA-Finance, Marketing (Comm Skills-8 out of 10 and more)Bachelor’s degree in Management information systems, data analysis, Mathematics, statistics, information management, MBA.

What's in It for You

Besides a competitive compensation package, you'll be working with a great group of technologists interested in always finding the right tool for the job in a culture that encourages innovation. If you're ready to take on some new technical challenges at a well-respected company, we'd love to hear from you. Recent graduates are encouraged to apply.

Recent Graduates are encouraged to apply

Email your resume: jas@anjaneyap.com
Company Description
Anjaneyap is a Global management and Technology services company. Our business transformation services create strategic advantage, improve business processes, leverage technology innovation and enhance organizational performance for our clients Worldwide. Our service offering include Full time and Project Management. Headquartered in Miplitas, CA, we work with leading Global 2000 firms in the Financial Services, Technology, Communications & Media, Manufacturing and Retail domains by engaging the customer in a ‘collaborative’ approach.
One thing that was very clear to us before we started Anjaneyap is that, employees are our assets and if we take care of them we basically take of our Clients."
Entry Level Business Intelligence / Data Analyst,Black Diamond Networks,4.5 ★,,"– Andover, MA","Position Overview
The US economy is stronger than ever, companies are hiring at record numbers, and good talent (particularly in the Technology space) is hard to find. That's where we step in. Black Diamond Networks (BDN) is the leading supplier of experienced Technology professionals Nationwide, and we are looking to add motivated, driven individuals interested in gaining experience is this fast-paced industry.

We have a great opportunity at our headquarters in Andover, MA for a Business Intelligence / Data Analyst to help us transform data and provide accurate and timely decision support to our leadership. Reporting to the Sr. Dir. Of Business Systems & Performance, in this role you will be required to find new ways of using data to build impactful narratives through reporting for our various business units and teams. This is a great opportunity to accelerate your career, especially for candidates that are technically capable but have not been able to transition into a technical position. This role will query data from different business systems, perform complex operations on data, and translate that data into finished reports/presentations. The successful candidate will have excellent communication and problem-solving skills, demonstrated success in developing persuasive reporting, and the ability to juggle competing priorities while delivering results.

Key Responsibilities
Lead the reporting function within the Business Systems & Performance organization.
Work together with the Sr. Dir of Business Systems & Performance to evaluate and implement a BI solution that meets BDNs operating reporting needs.
Work with leadership to clearly define business reporting needs.
Ensure data quality and identifying methods to reduce error rates.
Extract, transform, clean, and prepare data from various enterprise sources to conduct impactful analysis and thoughtful interpretation of business unit results for senior leadership.
Collaborate across business teams to proactively identify improvements to current processes and reporting practices.
Maintains highly organized work environment, understands importance of time management, and communicates in a clear, concise and effective manner.
Understands BDNs sales and recruiting business model and workflows.
Reviews account executive/recruiter/team performance and exception reports and makes appropriate corrections to ensure accurate reporting for management.
Qualifications
Bachelors degree in Business, Analytics or closely related degree.
Requires proven analytical skills with ability to organize, maintain, process and analyze large amounts of information and complex issues.
High level of proficiency of Microsoft Excel.
Experience with SQL, Access or other database reporting tools.
Strong background and experience in data analysis utilizing various data visualization programs such as Tableau, Sisense or similar software.
Proven ability to communicate findings in a clear, concise manner whether verbally, graphically, or in writing to a variety of audiences and stakeholders.
Self-starter, open-minded, creative, and collaborative focus with the ability to think outside the box for solutions to complex challenges.
High levels of natural curiosity in the business impacts of what the data reveals - driven to understand what data means and how it should drive the recommendations.
Self-motivation, strong work ethic, with a high attention to detail."
New Grad - D3 - Junior Data Engineer,Allstate,3.5 ★,$89k-$101k(Glassdoor est.),"– Bothell, WA","Where good people build rewarding careers.

Think that working in the insurance field can’t be exciting, rewarding and challenging? Think again. You’ll help us reinvent protection and retirement to improve customers’ lives. We’ll help you make an impact with our training and mentoring offerings. Here, you’ll have the opportunity to expand and apply your skills in ways you never thought possible. And you’ll have fun doing it. Join a company of individuals with hopes, plans and passions, all using and developing our talents for good, at work and in life.
Job Description

Job Family Summary
The Data, Discovery and Decision Science (D3) department leverages data & analytics to help the enterprise understand the best course of action to deliver on our corporate priorities, improve our business processes to gain operational efficiency and better equip our agencies and employees with the tools and insights necessary to better serve our customers and live into our customer value proposition.

Data Analytics incorporates techniques from many disciplines, including data acquisition, computer programming, data engineering, software development, high performance computing, and traditional business expertise, with the goal of extracting meaning from data to optimize future business decisions. Individuals in this field should wish to be experts in several of these disciplines and sufficiently proficient in others to effectively design, build, and deliver end to end products to optimize future decisions. Successful individuals demonstrate significant analytic agility, and quickly develop new skills across these disciplines as they evolve. The Junior Data Engineer role is responsible for working with clients to create scaled out business solutions and/or data using best practices, appropriate tools and software to provide documented, trusted and actionable results. This role requires analytic agility and the ability to quickly learn new techniques and technologies.

Job Summary
D3: Data, Discovery & Decision Science is the research and analytics organization for Allstate. Our mission is to enable, through analytics, the delivery of perfect insurance solutions to our customers.

This is an entry level role with a target start date in January 2019 or Summer 2019.
This role is responsible for the development of data infrastructure, business solutions, and proof of concept to help D3 achieve its mission. This includes creating new and maintaining existing data acquisition processes from inception to fully developed solutions. This role requires close integration and partnership with business, and a high degree of business acumen is needed to output the best technical solutions. To be successful in this role, a person should establish themselves as a subject matter expert.

Key Responsibilities:
Utilize multidisciplinary approach to Data Analytic problems to combine technical, analytics and business knowledge.
Demonstrate high degree of analytic agility to meet fluid and dynamic business needs.
Break down business problems into solvable components to recommend solutions.
Use a wide variety of tools and languages to achieve results (e.g., Python, C++, Java, Scala, SQL).
Rapid development of new data and analytics prototypes.
Develop and deliver data infrastructure to enable advanced analytics.
Explore data sources to better understand the availability and quality of data.
Document available data sources and how they are being transformed.
Embrace an environment that supports innovation and process improvement.
Disseminate knowledge across the team.
Qualifications
Target Start date: January 2019 or Summer 2019
Pursuing and will complete a bachelor’s degree in computer science, mathematics, or equivalent.
Master's or PhD in these fields is a plus.
Ability to code and develop prototypes in languages such as Python, C++, Java, Scala, SQL
Some familiarity with the hadoop ecosystem desired.
Experience with Bash or Korn Shell Scripting desired.
Familiarity with statistical concepts and related technology (R, SAS, Matlab) is a plus.
Demonstrated analytic agility and problem solving skills.
Ability and desire to learn new languages and technologies.
Strong attention to detail.
Solid written and oral communication skills.
Desire to share and inform others.

This position is posted in multiple locations, please apply to the location you are most interested in.

The candidate(s) offered this position will be required to submit to a background investigation, which includes a drug screen.

Good Work. Good Life. Good Hands®.

As a Fortune 100 company and industry leader, we provide a competitive salary – but that’s just the beginning. Our Total Rewards package also offers benefits like tuition assistance, medical and dental insurance, as well as a robust pension and 401(k). Plus, you’ll have access to a wide variety of programs to help you balance your work and personal life -- including a generous paid time off policy.

Learn more about life at Allstate. Connect with us on Twitter, Facebook, Instagram and LinkedIn or watch a video.

Allstate generally does not sponsor individuals for employment-based visas for this position.

Effective July 1, 2014, under Indiana House Enrolled Act (HEA) 1242, it is against public policy of the State of Indiana and a discriminatory practice for an employer to discriminate against a prospective employee on the basis of status as a veteran by refusing to employ an applicant on the basis that they are a veteran of the armed forces of the United States, a member of the Indiana National Guard or a member of a reserve component.

For jobs in San Francisco, please click ""here"" for information regarding the San Francisco Fair Chance Ordinance.

For jobs in Los Angeles, please click ""here"" for information regarding the Los Angeles Fair Chance Initiative for Hiring Ordinance.

It is the policy of Allstate to employ the best qualified individuals available for all jobs without regard to race, color, religion, sex, age, national origin, sexual orientation, gender identity/gender expression, disability, and citizenship status as a veteran with a disability or veteran of the Vietnam Era."
Big Data Engineer (Entry Level),Allstate Insurance Company,3.5 ★,$88k-$100k(Glassdoor est.),"– Irving, Texas","Job ID : ******
Location : Irving, TX US
Level : Entry Level Professional
Job Category : Information TechnologyDescription :
Where good people build rewarding careers.
Think that working in the insurance field can't be exciting, rewarding and challenging? Think again. You'll help us reinvent protection and retirement to improve customers' lives. We'll help you make an impact with our training and mentoring offerings. Here, you'll have the opportunity to expand and apply your skills in ways you never thought possible. And you'll have fun doing it. Join a company of individuals with hopes, plans and passions, all using and developing our talents for good, at work and in life.

Job Family Summary

Data Science incorporates techniques across many disciplines - including mathematics/statistics, computer programming, data engineering and ETL, software development, and high performance computing - with traditional business expertise with the goal of extracting meaning from data to optimize future business decisions. Individuals in this field should be an expert/fluent in several of these disciplines and sufficiently proficient in others to effectively design, build, and deliver end to end predictive analytics products to optimize future decisions. Individual demonstrates sufficient analytic agility to quickly develop new skills across these disciplines as those disciplines evolve. The Big Data Engineer job family is accountable for end to end engineering of data solutions which includes designing and building systems for data storage and analytics that enable Allstate analysts to make better decisions to achieve Allstate's goals.

Job Summary

This role is responsible for providing input on tracks of work to deliver Big Data solutions enabling advanced data science and analytics. This includes working with the team on new Big Data systems for analyzing data; the coding & development of advanced analytics solutions to make/optimize business decisions and processes; integrating new tools to improve descriptive, predictive, and prescriptive analytics. This role contributes to the structured and unstructured Big Data / Data Science tools.

Key Responsibilities
Executes basic to moderately complex functional work tracks for the team.
Partners with ATSV teams on Big Data efforts.
Partners closely with team members on Big Data solutions for our data science community and analytic users.
Provides support to team on development of basic to moderately complex technical solutions using Big Data techniques in data & analytics processes.
Develops innovative solutions to Big Data issues and challenges within the team
Provides support to team on the development of basic to moderately complex prototypes and department applications that integrate big data and advanced analytics to make business decisions.
Uses new areas of Big Data technologies, (ingestion, processing, and distribution) that can solve business problems.
Knowledge/Skills/Abilities/Experience
0 - 2 Years of experience or equivalent skills & ability
Bachelors or Master's preferred in a quantitative or scientific field such as computer science, computer engineering or equivalent experience.
Understanding of using software development to drive data science & analytic efforts.
Experience with database & ETL concepts.
Experience with various data types (e.g. Relational, Unstructured, Hierarchical, and Linked Graph Data).
Experience in working with statistical software such as SAS, SPSS, MatLab, R, CART, etc.
Ability to code and develop prototypes in languages such as Python, Perl, Java, C, R, SQL, XSLT.
Ability to communicate and present technical topics to technical audiences.
The candidate(s) offered this position will be required to submit to a background investigation, which includes a drug screen.
Good Work. Good Life. Good Hands.
As a Fortune 100 company and industry leader, we provide a competitive salary - but that's just the beginning. Our Total Rewards package also offers benefits like tuition assistance, medical and dental insurance, as well as a robust pension and 401(k). Plus, you'll have access to a wide variety of programs to help you balance your work and personal life -- including a generous paid time off policy.
Learn more about life at Allstate. Connect with us on Twitter, Facebook, Instagram and LinkedIn or watch a video.

Allstate generally does not sponsor individuals for employment-based visas for this position.
Effective July 1, 2014, under Indiana House Enrolled Act (HEA) 1242, it is against public policy of the State of Indiana and a discriminatory practice for an employer to discriminate against a prospective employee on the basis of status as a veteran by refusing to employ an applicant on the basis that they are a veteran of the armed forces of the United States, a member of the Indiana National Guard or a member of a reserve component.

For jobs in San Francisco, please click 'here' for information regarding the San Francisco Fair Chance Ordinance.
For jobs in Los Angeles, please click 'here' for information regarding the Los Angeles Fair Chance Initiative for Hiring Ordinance.

It is the policy of Allstate to employ the best qualified individuals available for all jobs without regard to race, color, religion, sex, age, national origin, sexual orientation, gender identity/gender expression, disability, and citizenship status as a veteran with a disability or veteran of the Vietnam Era."
