name,company,company_review,est_salary,location,description
Lead PKPD Data Manager (Associate Director level),GlobalSubmit,4.2 ★,$44k-$69k(Glassdoor est.),"– Philadelphia, PA","Certara is hiring a Lead PKPD Data Manager (Associate Director) to lead our PKPD programming team, which supports our Clinical Pharmacologists and Pharmacometrians, as well as various clientst in our integrated drug development group!
About Certara Strategic Consulting
Certara Strategic Consulting is the largest pharmacometric organization in the world and assures that various career pathways are offered to match the ambition and personal interests of our employees! We are a division of Certara and deliver value by integrating advanced simulation approaches into the most crucial drug development deliverables—to inform internal decision-making and strengthen global regulatory submissions. Leveraging our experience working on thousands of key drug development projects on behalf of hundreds of biopharma companies, we bring a track record of success and a broad range of expertise to each assignment.
Job Summary
This is a hands on lead position that will serve on client consulting teams to coordinate and lead data management and exchange activities for various projects. The Lead PKPD Data Manager will be responsible for overseeing a group of PKPD data programmers that are responsible for conducting data-management in support of CSRs and PKPD modeling and clinical outcomes databases for model-based meta-analyses. The PKPD data programmers also conduct quality control and quality assurance activities on datasets and reports, and may participate in company initiatives to improve efficiency of dataset construction, analysis and reporting (e.g. IT, methodology, efficiency, automation, quality).
The qualified candidate will have an MS, BS, or equivalent in Pharmaceutical Sciences, Pharmacology, Toxicology, Statistics, Mathematics, or related field with a minimum of 5 years’ experience and expertise in PKPD data analysis, data management, reporting, and regulatory submission requirements and at least 3 years' supervisory/management experience.
**We prefer candidates that can work in our Raleigh, NC or Parsippany, NJ offices, but will also consider well experienced remote based candiates.**
Responsibilities
Serve on client consulting teams to coordinate and lead data management and exchange activities for client projects.
Responsible for conducting data-management and programming in support of the conduct, reporting, and submission of PK and PD analyses, including both non-compartmental and population analyses.
Responsible for coordination of company activities (e.g. IT, methodology, automation) to improve efficiency and quality of dataset construction, analysis workflow, reporting, and submission of data to health authorities.
Oversee and perform quality control (QC) review of data programs.
Oversee and collaborate with team members to develop Data and QC processes and automation for Pharmacometric data management activities.
Assist in the review of final reports for regulatory submissions with respect to data management activities.
Provide training to staff and help to develop data programming skills and efficiencies.
Ensure that work is delivered on time and within budget in order to achieve business results.
Support and collaborate with project teams of scientific professionals in pharmaceutical and biotechnology companies involved in the development of small and large molecule drugs.
Manage team of PKPD data programmers (Associate Scientists).
Education & Experience
BS, MS, or equivalent in Data Sciences, Pharmaceutical Sciences, Pharmacology, Toxicology, Statistics, Mathematics, or related field.
Minimum 5 years’ experience and expertise in PKPD data analysis, data management, reporting, and regulatory submission requirements.
Minimum 3 years’ experience in a supervisory or management role.
Must have expert level understanding of data collection and database concepts including data flows in clinical trials, and Pharma industry data standards, such as CDISC/SDTM and ADaM data models.
Must be an expert in SAS dataset construction, with a strong preference for familiarity with PK and PKPD datasets (e.g., WinNonlin, NONMEM), R skills are a plus.
Special emphasis is placed on familiarity with regulatory requirements and trends with respect to data standards.
Demonstrated ability to produce the major deliverables associated with the planning, execution, and reporting of a clinical study.
Demonstrated ability to produce Pharma industry data standard and Sponsor defined clinical data deliverables.
General knowledge of clinical drug development and demonstrated knowledge of pharmacokinetics and pharmacology.
Proficiency in performing PK and statistical analysis using software (e.g., WinNonlin, Phoenix, AutoPilot and SAS, R) is preferred.
Entry level developing PK(PD) modeling is a plus.
Advanced training in R/SAS programming is strongly preferred.
Skills & Abilities
Accuracy and a sense of urgency are key in delivering high quality on time.
Ability to support and coordinate multiple projects as requested.
Strong collaborative skills, team player mentality.
Comfortable in a client environment able to communicate with and collaborate with scientists.
Ability to identify new business development opportunities through client interactions.
Ability to work across functions to implement company initiatives.
Ability to supervise/provide oversight of PKPD data programmers.
Excellent English verbal and written communication skills.
Excellent interpersonal skills.
About Certara
Certara is a growing company that provides a novel and exciting place to work. Our purpose is to assist in accelerating the development of meaningful medicines that make an impact on our society and the people that need them most. Innovation and creativity are highly valued, and everyone is given the opportunity for training and continuous development. Our portfolio spans the discovery, preclinical, clinical and post-marketing phases of drug development, working with 1,200 commercial companies, 250 academic institutions, and numerous regulatory agencies.
The wellbeing of our employees is a priority at Certara, and that is why we support the most important aspects of their lives:
Financial – competitive pay, incentives, retirement plans, income security programs
Health and Wellness – comprehensive benefit package, wellness programs, healthy lifestyle office environments
Work/Life –unlimited paid time off and an employee assistance program
Growth & Development – performance driven environment
Community Impact – volunteering opportunities, matching gifts, charitable contributions"
"Data Manager, Sr.",Apex Life Sciences,2.5 ★,$50k-$81k(Glassdoor est.),"– Berkeley Heights, New Jersey","Job Description
CORE JOB FUNCTIONS:

Oversee the management of clinical trial databases from study start up to study closure.
Be able to review and understand protocol synopsis and attend if required any protocol review meetings and act as subject matter expert for proper data capture based on protocol requirements.
Lead Case Report Form Design according to the protocol with all Study Team members using establed standards
Author and or review CRF completion guidelines
Develop or lead in the review of a Data Management Plan (DMP), when applicable, that outlines database design and testing, CRF flow, data queries, manual checks, coding, SAE reconciliation, third party vendor reconciliations, specification of data listings needed to facilitate data cleaning in accordance to a Data Review Plan, data lock and archiving, etc.
Develop and test edit specifications which may include the development of test scripts used for UAT as well as perform/coordinate UAT testing
When applicable ensure coding has been performed and reviewed by Medical Coder, Perform external data reconciliation, Provision of data management related metrics, provision of specific data listings as required by the medical group and review when necessary
Make data, including interim data, available to company personnel and to regulatory agencies when required
Trouble-shoot database issues with DBA until resolution is obtained
Perform database lock and freeze activities
If required prepare and present data collection requirements at Investigator Meeting
Be experienced in the management and oversight of CROs and consultants:
Participate in CRO selection if required
Be able to Review SOWs for data management activities and costs in contracts
Interact with CROs in the design and development of databases that are compatible with company needs, monitor progress of data management activities in CROs
Participate in regular team meetings and provide input when appropriate
Assist in database upgrades/migrations including performing User Acceptance Tests
Train Data Managers on standards and processes
Serve as the DM representative on clinical project teams that are developing NDAs

KNOWLEDGE/SKILLS/ABILITIES (KSA's):

IMPORTANT: Manager is looking for extra strong candidate that pick-up and learn quickly. Not looking for entry level. Candidate must be open-minded to new processes and new direction from what they may be used to.
BS/BA degree or equivalent in a relevant scientific discipline with a minimum of five years experience as a LEAD data manager in a pharmaceutical/CRO setting
Must be a Senior Level Person and familiar and experienced in all aspects of Data Management Responsibilities.
Must be familiar with all phases of clinical trials (Phase 1 Phase 4).
Must have experience on Phase 1 studies as a Sr Level person assigned to more complex studies
Oncology experience
Ability to interact with physicians, scientists, monitors, programmers, study managers and statisticians in creating an appropriate database, data quality assurance, and resolution of data queries
Experienced in understanding Sponsor responsibilities of oversight of a CRO.
Proficient knowledge of EDC preferably Medidata RAVE. Knowledge of JReview is a plus.
Basic knowledge of budget forecasting
Excellent communication skills; ability to work in a team environment with medical personnel, clinical monitors, statisticians, programmers, and medical writers
Proficiency in regulatory guidelines, agencies, GCP
Advanced knowledge of clinical trial process and data management process

#LI-NV1

EEO Employer

Apex is an Equal Employment Opportunity/Affirmative Action Employer. All qualified applicants will receive consideration for employment without regard to race, color, religion, sex, age, sexual orientation, gender identity, national origin, disability, protected veteran status, or any other characteristic protected by law. Apex will consider qualified applicants with criminal histories in a manner consistent with the requirements of applicable law. If you have visited our website in search of information on employment opportunities or to apply for a position, and you require an accommodation in using our website for a search or application, please contact our Employee Services Department at 844-463-6178.

903130* IMPORTANT: Manager is looking for extra strong candidate that pick-up and learn quickly. Not looking for entry level. Candidate must be open-minded to new processes and new direction from what they may be used to. * BS/BA degree or equivalent in a relevant scientific discipline with a minimum of five years experience as a LEAD data manager in a pharmaceutical/CRO setting * Must be a Senior Level Person and familiar and experienced in all aspects of Data Management Responsibilities. * Must be familiar with all phases of clinical trials (Phase 1 - Phase 4). * Must have experience on Phase 1 studies as a Sr Level person assigned to more complex studies * Oncology experience * Ability to interact with physicians, scientists, monitors, programmers, study managers and statisticians in creating an appropriate database, data quality assurance, and resolution of data queries * Experienced in understanding Sponsor responsibilities of oversight of a CRO. * Proficient knowledge of EDC preferably Medidata RAVE. Knowledge of JReview is a plus. * Basic knowledge of budget forecasting * Excellent communication skills; ability to work in a team environment with medical personnel, clinical monitors, statisticians, programmers, and medical writers * Proficiency in regulatory guidelines, agencies, GCP * Advanced knowledge of clinical trial process and data management process"
Senior Scientist I - NA X-Category Productivity - Mondelēz International,Mondelēz International,3.4 ★,,– New York,"Description

With our portfolio of global Power Brands such as Oreo and belVita biscuits, Cadbury Dairy Milk and Milka chocolate and Trident gum, were the worlds #1 in biscuits and candy, and #2 in chocolate and gum. Were Mondelēz International , a snacking powerhouse with operations in more than 80 countries, with approximately 90,000 employees globally and our brands are marketed in around 165 countries.

Our purpose and vision is to create more MOMENTS OF JOY by building the BEST SNACKING COMPANY IN THE WORLD .

Take a look at this exciting opportunity to work in NA RD&Q X-Category Productivity, based in East Hanover, NJ. This position is part of my team and we are looking forward to get applications from people who are passionate and want an exciting career in Research Development &Quality. Also helps if you like biscuits, candy and chocolate...

In Research, Development & Quality (RD&Q), your skills can be the special ingredient that brings our brands to life. As part of a fantastic team of scientists, engineers and nutritionists, youll work tirelessly on product design or development, process development, quality, nutrition, sensory and food safety aspects to ensure we deliver a consistent, delightful consumer experience. RD&Q is where youll turn great ideas into brilliant brands.

The position sits within the NA Cross Category Productivity team and is responsible for planning and executing NA productivity projects across the Biscuit, Gum & Candy, and Chocolate categories. The role is essential to deliver regional R&P & margin targets while maintaining or improving consumer acceptability and brand requirements.

Main Responsibilities:
Deliver technical solutions to drive cost out of NA products
Plan and execute Productivity & other Margin Improvement projects - including developing objectives, risk assessments & contingency plans
Design, plan, and execute bench top experiments, pilot plant trials and plant trials.
Analyze results of experiments and translate them into actionable recommendations with minimal guidance and support
Identify and efficiently utilize necessary resources to achieve timely delivery of project objectives
Coordinate sensory and analytical testing of prototypes
Act as a technical resource for entry level members of the RDQI community
Lead and participate in cross functional teams to identify and resolve technical issues.
Build strong relationships within RDQI, Procurement, Marketing, Finance, and ISC.
Work collaboratively to gain alignment across teams.
Write ICs and PDRs and update formulations and specifications.



Qualifications

1. Bachelor's Degree in Food Science, Chemical Engineering, or other related technical field
Minimum 5 years food industry experience
Strong technical foundation and technical curiosity
3 years of Project Management Skills
Ability to develop and drive technical projects with proper scientific rigor: conduct appropriate testing, gather and analyze data and develop recommendations based on findings
Knowledge of Advanced Excel and Minitab
Excellent problem-solving abilities
Strong learning agility
Ability to handle multiple priorities
Excellent oral and written skills and have the ability to present technical findings to team
Ability to work collaboratively with cross-functional teams, internal RDQ stakeholders and colleagues while providing technical input on all projects
Ability to travel up to 20% (Domestic and International - Canada and Mexico) Mondelēz Global LLC is an Equal Opportunity/Affirmative Action employer. All qualified applicants will receive consideration for employment without regard to race, color, religion, sex, national origin, disability, protected Veteran status, sexual orientation, gender identity, gender expression, genetic information, or any other characteristic protected by law. Applicants who require accommodation to participate in the job application process may contact 847-943-5460 for assistance."
"Data Manager, Sr. - NJ -",Aequor,4.1 ★,$116k-$180k(Glassdoor est.),"– Berkeley Heights, New Jersey","Typical Daily Work schedule (start/end times) = 830am-5pm (some flexibility in start/end times as long as full day is worked) 40 Hrs/Week
Weekend work not required, but might be needed on occasion (would coord hrs so as not to go into Overtime)
100% onsite for first few months, Mgr might consider some offsite later on.

CORE JOB FUNCTIONS:

? Oversee the management of clinical trial databases from study start up to study closure.
(A) Be able to review and understand protocol synopsis and attend if required any protocol review meetings and act as subject matter expert for proper data capture based on protocol requirements.
(B) Lead Case Report Form Design according to the protocol with all Study Team members using establed standards
(C) Author and or review CRF completion guidelines
(D) Develop or lead in the review of a Data Management Plan (DMP), when applicable, that outlines database design and testing, CRF flow, data queries, manual checks, coding, SAE reconciliation, third party vendor reconciliations, specification of data listings needed to facilitate data cleaning in accordance to a Data Review Plan, data lock and archiving, etc.
(E) Develop and test edit specifications which may include the development of test scripts used for UAT as well as perform/coordinate UAT testing
(F) When applicable ensure coding has been performed and reviewed by Medical Coder, Perform external data reconciliation, Provision of data management related metrics, provision of specific data listings as required by the medical group and review when necessary
(G) Make data, including interim data, available to company personnel and to regulatory agencies when required
(H) Trouble-shoot database issues with DBA until resolution is obtained
(I) Perform database lock and freeze activities
(J) If required prepare and present data collection requirements at Investigator Meeting
(K) Be experienced in the management and oversight of CROs and consultants:
(L) Participate in CRO selection if required
(M) Be able to Review SOWs for data management activities and costs in contracts
(N) Interact with CROs in the design and development of databases that are compatible with company needs, monitor progress of data management activities in CROs
(O) Participate in regular team meetings and provide input when appropriate
? Assist in database upgrades/migrations including performing User Acceptance Tests
? Train Data Managers on Client standards and processes
? Serve as the DM representative on clinical project teams that are developing NDAs

KNOWLEDGE/SKILLS/ABILITIES (KSA's):

? IMPORTANT: Manager is looking for extra strong candidate that pick-up and learn quickly. Not looking for entry level. Candidate must be open-minded to new processes and new direction from what they may be used to.
? BS/BA degree or equivalent in a relevant scientific discipline with a minimum of five years experience as a LEAD data manager in a pharmaceutical/CRO setting
? Must be a Senior Level Person and familiar and experienced in all aspects of Data Management Responsibilities.
? Must be familiar with all phases of clinical trials (Phase 1 ? Phase 4).
? Must have experience on Phase 1 studies as a Sr Level person assigned to more complex studies
? Oncology experience
? Ability to interact with physicians, scientists, monitors, programmers, study managers and statisticians in creating an appropriate database, data quality assurance, and resolution of data queries
? Experienced in understanding Sponsor responsibilities of oversight of a CRO.
? Proficient knowledge of EDC preferably Medidata RAVE. Knowledge of JReview is a plus.
? Basic knowledge of budget forecasting
? Excellent communication skills; ability to work in a team environment with medical personnel, clinical monitors, statisticians, programmers, and medical writers
? Proficiency in regulatory guidelines, agencies, GCP
? Advanced knowledge of clinical trial process and data management process"
Food Scientist (Entry level),Apex Life Sciences,2.5 ★,$33k-$56k(Glassdoor est.),"– Middlesex, New Jersey","Quality Assurance Associate

Responsibilities
Responsible for the quality and safety of flavors and extracts.
To monitor the quality of incoming raw materials, incoming packaging materials, intermediates and finished goods.
Conduct weekly or more frequent inspection in production and warehouse to ensure compliance with FSSC 22000, GMP and HACCP requirements.
Coordinate with commercial department to prepare related technical and shipping documents, pertaining to customer complaint or be responsible for any product recall case.
Responsible to send samples for different analytical test by independent laboratory.
Conduct shelf life/stability test for flavor product.
As a Food Safety team member, ensure implementation and maintenance of food safety requirements.
Schedule pickups, call the lab for samples, compile data
To be involved as internal auditor for company internal audit as an assistant
To conduct raw material study request for substitution of existing raw material.
Act on sensory panel in approving the quality of the samples, raw material and finish product.
Conduct shipment check and schedule pickups
Authority
Taking on some of the manager's responsibilities and working more closely with management;
Being involved in the decision-making process.
Competency

Educational Level and Working Experience
Degree in Food Science, Chemistry, or Microbiology preferred
Experience in quality control, or analytical laboratories
Ability to liaise with related government agencies and certificate control
Must possess strong strategic planning and project management capabilities
Microsoft Suite
PLUS: Microsoft Visio

Talent/Skill
Strong interpersonal and communication skills.
Able to work independently.
Job Type: Contract

Experience:
Quality Control: 1 year (Preferred)"
